{
  "id": "schedule_10",
  "name": "Schedule 10 - Management Fees",
  "depends_on": [
    "owners_operating_statement"
  ],
  "rank": 12,
  "standard_category_ids": [9],
  "draft": false,

  "columns": [
    {"type": "actual", "range": "current_period", "year": "current", "name": "PTD $"},
    {"type": "percentage", "range": "current_period", "year": "current", "name": "PTD %"},
    {"type": "budget_actual", "range": "current_period", "year": "current", "name": "Budget $"},
    {"type": "budget_percentage", "range": "current_period", "year": "current", "name": "Budget %"},
    {"type": "budget_variance", "range": "current_period", "name": "Budget Var"},
    {"type": "actual", "range": "current_period", "year": "prior", "name": "PTD LY $"},
    {"type": "percentage", "range": "current_period", "year": "prior", "name": "PTD LY %"},
    {"type": "actual", "range": "ytd", "year": "current", "name": "YTD $"},
    {"type": "percentage", "range": "ytd", "year": "current", "name": "YTD %"},
    {"type": "budget_actual", "range": "ytd", "year": "current", "name": "Budget $"},
    {"type": "budget_percentage", "range": "ytd", "year": "current", "name": "Budget %"},
    {"type": "budget_variance", "range": "ytd", "name": "Budget Var"},
    {"type": "actual", "range": "ytd", "year": "prior", "name": "YTD LY $"},
    {"type": "percentage", "range": "ytd", "year": "prior", "name": "YTD LY %"}
  ],
  "missing_transactions_calculation_disabled": false,
  "view_by_options": ["rooms_sold"],
  "items": [
    {
      "id": "summary",
      "name": "Summary",
      "_description": "This section consists of items that use standard hotel metrics to calculate the values"
    },
    {
      "id": "rooms_available",
      "name": "Rooms Available to sell",
      "parent_id": "summary",
      "type": {
        "name": "reference",
        "reference": "owners_operating_statement/rooms_available",
        "metric": {
          "name": "Available Rooms"
        }
      }
    },
    {
      "id": "rooms_sold",
      "name": "Rooms Sold",
      "parent_id": "summary",
      "type": {
        "name": "reference",
        "reference": "owners_operating_statement/rooms_sold",
        "metric": {
          "name": "Sold Rooms"
        }
      }
    },
    {
      "id": "occupancy_percent",
      "name": "Occupancy %",
      "parent_id": "summary",
      "type": {
        "name": "reference",
        "reference": "owners_operating_statement/occupancy_percent"
      },
      "values": {
        "actual": {
          "value": {
            "expression": {
              "operator": "%",
              "arg1": {
                "item_id": "rooms_sold"
              },
              "arg2": {
                "item_id": "rooms_available"
              }
            }
          }
        }
      }
    },
    {
      "id": "management_fee",
      "name": "Management Fee"
    },
    {
      "id": "base_fee",
      "name": "Base Fee",
      "parent_id": "management_fee",
      "type": {
        "name": "quickbooks_ledger"
      },
      "values": {
        "percentage": {
          "value": {
            "expression": {
              "operator": "%",
              "arg1": {
                "item_id": "base_fee"
              },
              "arg2": {
                "item_id": "owners_operating_statement/total_operating_revenue"
              }
            }
          }
        }
      }
    },
    {
      "id": "incentive_fees",
      "name": "Incentive Fees",
      "parent_id": "management_fee",
      "type": {
        "name": "quickbooks_ledger"
      },
      "values": {
        "percentage": {
          "value": {
            "expression": {
              "operator": "%",
              "arg1": {
                "item_id": "incentive_fees"
              },
              "arg2": {
                "item_id": "owners_operating_statement/total_operating_revenue"
              }
            }
          }
        }
      }
    },
    {
      "id": "total_management_fee",
      "name": "Total Management Fee",
      "parent_id": "management_fee",
      "totals": true,
      "values": {
        "percentage": {
          "value": {
            "expression": {
              "operator": "%",
              "arg1": {
                "item_id": "total_management_fee"
              },
              "arg2": {
                "item_id": "owners_operating_statement/total_operating_revenue"
              }
            }
          }
        }
      }
    }
  ]
}